datetime,ip_address,NIK,applicant_name,age,gender,marital_status,number_of_dependents,occupation,job_position,job_specific_code,job_specific,education_level,user_income,collateral_value_of_on_site_assets,average_loans_taken_in_the_same_location,last_credit_history,other_credit_history1,other_credit_history2,other_credit_history3,worst_credit_performance,hardware,operating_system_type,browser,home_address,domicile_address,road_type,building_type,building_owner,building_location,gmaps_coordinates,gmaps_location_name,gmpas_location_description,gmaps_category,gmaps_address,gmaps_neighborhood,gmaps_street,gmaps_city,gmaps_postal_code,gmaps_state,total_population,average_income_of_the_population_in_the_area,education_of_the_population_in_the_area,unemployment_rate_in_the_area,crime_rate_in_the_area,poverty_rate_in_the_area,length_of_stay_at_domicile_address,address_stability,domicile_address_and_location_suitability,credit_risk
2023-03-16 13:49:16.708854,10.139.63.82,3529105307980009,"Cinta Melani, S.Pt",25,P,Belum Kawin,3,Pilot,Supervisor,50214,Angkutan Penyeberangan Antarprovinsi Untuk Penumpang,S3,2,125000000,1,3,0,2,3,0,Laptop,2,1,"Gang Astana Anyar No. 066
Lhokseumawe, Sulawesi Selatan 92970","Gang Astana Anyar No. 066
Lhokseumawe, Sulawesi Selatan 92970",Jalan Sedang,Villa,Perorangan Pribadi,Kawasan wisata,"-7.73379, 113.69785",Rumah Susun ,Officiis nihil enim.,Apartment complex,"Besuki, Situbondo, Jawa Timur, Indonesia",,,,,Jawa Timur,4,0,0,4,3,2,8,0,0,0
2023-03-16 13:49:19.380430,10.170.140.217,5312182207940003,Dr. Carla Lazuardi,29,L,Janda,2,Regent/Mayor,Supervisor,77400,"Sewa Guna Usaha Tanpa Hak Opsi Aset Non Finansial, Bukan Karya Hak Cipta",D4,0,829000000,1,1,0,4,1,2,Laptop,1,0,"Gg. Jamika No. 512
Purwokerto, YO 44465","Gg. Jamika No. 512
Purwokerto, YO 44465",Jalan Kecil,Rumah,Perorangan Pribadi,Kawasan pegunungan,"-7.4242782, 109.2396366",Kost-kostan ,Veniam eveniet exercitationem vitae laborum deleniti laborum.,Condominium complex,"Gg. Jamika No. 512
Purwokerto, YO 44465",,,Purwokerto,,Central Java,1,4,1,0,1,1,115,3,2,3
2023-03-16 13:49:19.674099,192.168.39.159,1701086606830002,Cut Clara Prasasta,40,P,Janda,3,Governor,Manager,25932,Industri Alat Potong Dan Perkakas Tangan Pertukangan,S2,4,756000000,3,4,3,1,0,2,PC,1,3,"Jalan Abdul Muis No. 4
Surabaya, JT 81657","Jalan Ir. H. Djuanda No. 52
Sorong, LA 73047",Jalan Sedang,Apartemen,Perorangan Pribadi,Kawasan perumahan miskin,"-0.8761629000000001, 131.255828",Mess ,Vitae deleniti quod eligendi.,Dormitory,"Jalan Ir. H. Djuanda No. 52
Sorong, LA 73047",,,Sorong,,West Papua,1,3,4,0,1,0,94,3,2,3
2023-03-16 13:49:20.244441,172.20.37.175,1306011112680006,Dr. Damu Hakim,55,L,Duda,5,Carpenter,Staff,73100,Periklanan,S1,0,616000000,0,2,0,2,0,2,Smartphone,3,0,"Jalan HOS. Cokroaminoto No. 8
Bengkulu, JB 89978","Jalan HOS. Cokroaminoto No. 8
Bengkulu, JB 89978",Jalan Sedang,Mess,Perorangan Orang Lain,Kawasan perumahan padat penduduk,"-6.48167, 106.85417",Kost-kostan ,Dignissimos deleniti expedita est ipsam exercitationem.,Residential neighbourhood,"Cibinong, Bogor, Jawa Barat, 16911, Indonesia",,,,16911,Jawa Barat,2,2,1,1,2,2,77,2,0,3
2023-03-16 13:49:21.778123,10.147.40.194,3204343102670000,Elma Pradana,56,L,Kawin,3,Vice Regent/Vice Mayor,Manager,95220,Reparasi Peralatan Rumah Tangga Dan Peralatan Rumah Dan Kebun,SMA/SMK,0,996000000,1,2,4,0,3,1,Laptop,1,1,"Gang Laswi No. 4
Banjarmasin, Kalimantan Timur 63493","Gg. Siliwangi No. 31
Langsa, Banten 55510",Jalan Sedang,Rumah Susun,Perorangan Pribadi,Kawasan perumahan elite,"-6.4058172, 106.0640179",Apartemen ,Amet et sint saepe asperiores repellendus.,Gated community,"Gg. Siliwangi No. 31
Langsa, Banten 55510",,,,,Banten,0,3,2,1,1,1,107,3,2,4
2023-03-16 13:49:21.982629,172.31.60.215,3506196605840002,"Mulyono Yolanda, S.Pd",39,P,Duda,1,Member of the Constitutional Court,Manager,46620,Perdagangan Besar Logam Dan Bijih Logam,S1,1,632000000,2,2,3,1,0,3,Laptop,2,4,"Gg. Jamika No. 1
Bukittinggi, JB 11575","Jl. Joyoboyo No. 8
Subulussalam, JB 74479",Jalan Sedang,Rumah Susun,Pemerintah,Kawasan komersial,"-6.8048, 110.8405",Apartemen ,Optio illo aliquam alias.,Townhouse,"Demaan, Kudus, Jawa Tengah, 59318, Indonesia",,,,59318,Jawa Tengah,1,3,3,1,1,2,67,2,0,0
2023-03-16 13:49:23.927369,192.168.194.67,3279026106520001,Kurnia Prastuti,71,P,Janda,0,Student,Supervisor,58110,Penerbitan Buku,S1,3,932000000,3,4,2,1,3,0,Laptop,5,5,"Jalan Asia Afrika No. 591
Dumai, JI 92944","Jalan Cikapayang No. 513
Sawahlunto, Sulawesi Selatan 24528",Jalan Sedang,Rumah Susun,Perorangan Orang Lain,Pusat kota,,Kontrakan ,Earum incidunt a veritatis eos animi minima.,,"Jalan Asia Afrika No. 591
Dumai, JI 92944",,,,,,2,2,2,2,3,2,43,1,0,3
2023-03-16 13:49:24.628663,10.61.31.205,6407071603870005,"Drs. Gangsa Hartati, S.Pt",36,L,Duda,1,Dentist,Staff,17012,Industri Kertas Budaya,S3,1,216000000,2,1,0,1,1,1,PC,1,6,"Gg. Kutai No. 58
Tanjungpinang, KR 53214","Jalan Peta No. 93
Sukabumi, SU 24713",Jalan Besar,Kost-kostan,Lainnya,Kawasan komersial,"0.51667, 101.44167",Apartemen Jalan Durian,Quaerat eius fuga corporis perferendis repellat atque.,House,"Jalan Durian, RT. 01, Kelurahan Jadirejo, Kabupaten Kampar, Riau, 28121, Indonesia",,Jalan Durian,Kelurahan Jadirejo,28121,Riau,2,3,3,2,1,2,86,2,0,1
2023-03-16 13:49:26.382689,172.19.194.184,9113444801740003,Eman Anggriawan,49,P,Kawin,3,Welder/blacksmith,Direktur,2142,Pengusahaan Pembibitan Tanaman Pinus,D4,4,786000000,0,1,0,4,0,1,PC,2,3,"Gg. Rawamangun No. 50
Kotamobagu, SR 28221","Gg. Rawamangun No. 50
Kotamobagu, SR 28221",Jalan Kecil,Rumah,Perorangan Pribadi,Kawasan perumahan padat penduduk,"0.7243733, 124.3199316",Rumah ,Quaerat nulla optio eveniet dolorem totam magni sapiente.,House,"Gg. Rawamangun No. 50
Kotamobagu, SR 28221",,,Kotamobagu,,North Sulawesi,4,0,1,3,3,2,23,0,2,2
2023-03-16 13:49:26.611606,172.30.218.10,7202203102650001,Rachel Gunarto,58,L,Belum Kawin,4,Artist,Supervisor,10779,Industri Produk Masak Lainnya,SMA/SMK,0,865000000,3,2,1,3,1,2,PC,1,4,"Jalan Jend. Sudirman No. 827
Cimahi, KU 72056","Jalan Jend. Sudirman No. 827
Cimahi, KU 72056",Jalan Besar,Kost-kostan,Lainnya,Kawasan pertanian,"-6.889090299999999, 107.5345504",Apartemen Jalan Jendral Sudirman,Numquam quas recusandae eius est dignissimos corrupti.,Duplex,"Jalan Jend. Sudirman No. 827
Cimahi, KU 72056",,Jalan Jendral Sudirman,,40521,Jawa Barat,2,3,2,2,2,0,74,2,2,4
2023-03-16 13:49:27.108982,10.98.146.44,6310035606850003,Ian Pangestu,38,P,Belum Kawin,5,Fisherman/fishery laborer,Direktur,10763,Industri Pengolahan Teh,S1,1,603000000,2,1,3,3,3,3,Smartphone,0,6,"Jl. Ronggowarsito No. 823
Makassar, Gorontalo 48170","Jl. Moch. Toha No. 75
Sukabumi, Sulawesi Tenggara 86583",Jalan Sedang,Apartemen,Perorangan Orang Lain,Kawasan pegunungan,"-5.1615828, 119.4359281",Perum ,Suscipit minus pariatur maxime.,Gated community,"Jl. Ronggowarsito No. 823
Makassar, Gorontalo 48170",,,Makassar,,South Sulawesi,0,4,4,0,0,1,112,3,0,1
2023-03-16 13:49:27.613371,172.28.17.117,1218112704980003,Kenes Wahyuni,25,L,Duda,1,Priest,Staff,46511,Perdagangan Besar Komputer Dan Perlengkapan Komputer,D4,2,570000000,0,3,0,1,0,3,PC,1,3,"Jl. M.T Haryono No. 7
Banjarbaru, Kalimantan Utara 58348","Jl. M.T Haryono No. 7
Banjarbaru, Kalimantan Utara 58348",Jalan Kecil,Kontrakan,Perorangan Orang Lain,Kawasan wisata,"-3.4572422, 114.8103181",Perum ,Doloribus omnis repudiandae temporibus ipsam reiciendis.,Residential neighbourhood,"Jl. M.T Haryono No. 7
Banjarbaru, Kalimantan Utara 58348",,,Banjarbaru,,South Kalimantan,3,2,2,2,3,1,59,1,2,2
